{
  "schemaVersion": "v1alpha1",
  "kind": "build-plan",
  "source": {
    "treeDigest": "sha256:1111111111111111111111111111111111111111111111111111111111111111",
    "commit": null,
    "dirty": true
  },
  "policy": {
    "mode": "standalone",
    "enforcementDigest": "sha256:5555555555555555555555555555555555555555555555555555555555555555",
    "requiredChecks": []
  },
  "tools": [
    {
      "id": "go",
      "version": "1.24.0",
      "digest": "sha256:2222222222222222222222222222222222222222222222222222222222222222",
      "platform": {
        "os": "linux",
        "arch": "amd64",
        "abi": "static"
      }
    }
  ],
  "targets": [
    {
      "id": "api",
      "builder": "go/app",
      "builderDigest": "sha256:3333333333333333333333333333333333333333333333333333333333333333",
      "path": ".",
      "variant": {},
      "platform": {
        "os": "linux",
        "arch": "amd64",
        "abi": "static"
      }
    }
  ],
  "actions": [
    {
      "id": "api.compile",
      "target": "api",
      "operation": "compile",
      "dependsOn": [],
      "argv": [
        "go",
        "build",
        "-o",
        "/out/server",
        "."
      ],
      "cwd": ".",
      "env": {},
      "tools": [
        "go"
      ],
      "executionPlatform": {
        "os": "linux",
        "arch": "amd64",
        "abi": "static"
      },
      "targetPlatform": {
        "os": "linux",
        "arch": "amd64",
        "abi": "static"
      },
      "inputs": [
        {
          "kind": "tree",
          "digest": "sha256:1111111111111111111111111111111111111111111111111111111111111111",
          "mount": "workspace"
        }
      ],
      "outputs": [
        "api/binary"
      ],
      "reports": [],
      "required": true,
      "cacheable": true,
      "network": "none",
      "limits": {
        "timeoutSeconds": 1800,
        "cpu": 1,
        "memoryBytes": 1073741824,
        "outputBytes": 10737418240
      }
    }
  ],
  "artifacts": [
    {
      "id": "api/binary",
      "target": "api",
      "variant": {},
      "name": "binary",
      "producer": "api.compile",
      "kind": "file",
      "version": "0.1.0-dev.g111111111111",
      "mediaType": "application/octet-stream",
      "path": "artifacts/api/default/binary/server"
    }
  ]
}
